### ISSUE TITLE
Codebase Indexing Doesn't Support Specifying an Alternative Qdrant Port and Silently Ignores It

### ISSUE THREAD

**Issue by strikeoncmputrz** [Kilo-Org/kilocode#814]
### Description

Hello, 

I attempted to use an existing qdrant db for codebase indexing. The service is listening on TCP 443. 

![Image](https://github.com/user-attachments/assets/7add7f6d-0f60-4268-b200-9c62a5e624a8)

Tcdpdump shows that Kilo ignores the port being specified and always attempts to connect to TCP 6333.

```
x0xxin@conductor:~$ sudo tcpdump -i any host qdrant.lan and not port 22
tcpdump: data link type LINUX_SLL2
tcpdump: verbose output suppressed, use -v[v]... for full protocol decode
listening on any, link-type LINUX_SLL2 (Linux cooked v2), snapshot length 262144 bytes
15:45:07.618564 enp4s0 Out IP conductor.lan.50872 > crowdsec.lan.6333: Flags [S], seq 3990034885, win 64240, options [mss 1460,sackOK,TS val 265264109 ecr 0,nop,wscale 7], length 0
15:45:08.277405 enp4s0 Out IP conductor.lan.50876 > crowdsec.lan.6333: Flags [S], seq 1736691184, win 64240, options [mss 1460,sackOK,TS val 265264768 ecr 0,nop,wscale 7], length 0
15:45:09.309266 enp4s0 Out IP conductor.lan.50876 > crowdsec.lan.6333: Flags [S], seq 1736691184, win 64240, options [mss 1460,sackOK,TS val 265265800 ecr 0,nop,wscale 7], length 0
15:45:10.333266 enp4s0 Out IP conductor.lan.50876 > crowdsec.lan.6333: Flags [S], seq 1736691184, win 64240, options [mss 1460,sackOK,TS val 265266824 ecr 0,nop,wscale 7], length 0
15:45:11.386538 enp4s0 Out IP conductor.lan.50880 > crowdsec.lan.6333: Flags [S], seq 2277444679, win 64240, options [mss 1460,sackOK,TS val 265267877 ecr 0,nop,wscale 7], length 0
15:45:12.444267 enp4s0 Out IP conductor.lan.50880 > crowdsec.lan.6333: Flags [S], seq 2277444679, win 64240, options [mss 1460,sackOK,TS val 265268935 ecr 0,nop,wscale 7], length 0
15:45:13.468269 enp4s0 Out IP conductor.lan.50880 > crowdsec.lan.6333: Flags [S], seq 2277444679, win 64240, options [mss 1460,sackOK,TS val 265269959 ecr 0,nop,wscale 7], length 0
^C
7 packets captured
17 packets received by filter
0 packets dropped by kernel
```

**Comment by catrielmuller** [comment]
Hi @strikeoncmputrz , I just send a PR to fix the issue it's related to the initialization of the Qdrant service that cache the URL string, in a meantime you can restart you vscode to use the new url string.

I have qdrant running there on the port 16333
![Image](https://github.com/user-attachments/assets/58cb29dc-61f4-490b-98be-351533a41eec)

**Comment by strikeoncmputrz** [comment]
Thanks!!
